{
  "$schema": "https://json-schema.org/draft/2020-12/schema",
  "$id": "https://example.com/mcp/document.schema.json",
  "title": "MCP Document",
  "type": "object",
  "required": ["id", "title", "version", "tags", "content", "source", "sourceUrl"],
  "properties": {
    "id": {"type": "string", "minLength": 1},
    "title": {"type": "string", "minLength": 1},
    "version": {"type": "string", "minLength": 1},
    "tags": {
      "type": "array",
      "items": {"type": "string", "minLength": 1},
      "minItems": 1
    },
    "content": {"type": "string", "minLength": 1},
    "source": {"type": "string", "minLength": 1},
    "sourceUrl": {"type": "string", "format": "uri"}
  },
  "additionalProperties": false
}
